{
  "$id": "metadata-profile@iqb-standard@0.10",
  "$schema": "http://json-schema.org/draft-07/schema#",
  "title": "Metadata Profile",
  "description": "Data interface for defining metadata for objects based on vocabularies of IQB.",
  "type": "object",

  "properties": {
    "id": {
      "type": "string",
      "description": "Identifier for the metadata profile"
    },
    "label": {
      "$ref": "#/definitions/language_coded_texts",
      "description": "Name of the profile"
    },
    "profileType": {
      "type": "string",
      "enum": [
        "unit",
        "item",
        "research_study",
        "copyright"
      ],
      "description": "Type of profile"
    },
    "groups": {
      "type": "array",
      "items": {
        "type": "object",
        "properties": {
          "label": {
            "$ref": "#/definitions/language_coded_texts"
          },
          "entries": {
            "type": "array",
            "items": {
              "$ref": "#/definitions/entry"
            },
            "minItems": 1
          }
        },
        "required": ["label", "entries"]
      },
      "minItems": 1
    }
  },
  "required": ["id", "label", "profileType", "groups"],
  "definitions": {
    "language_coded_texts": {
      "type": "array",
      "description": "Used for storing the input of texts. This type applies also in cases when only one language is used.",
      "items": {
        "type": "object",
        "properties": {
          "lang": {
            "type": "string",
            "minLength": 1,
            "description": "ISO-language code",
            "pattern": "^[a-z]{2}$"
          },
          "value": {
            "type": "string"
          }
        },
        "required": [
          "lang",
          "value"
        ],
        "additionalProperties": false
      },
      "minItems": 1
    },
    "vocabulary": {
      "type": "object",
      "description": "Creates values of type string (one possible id), string[] (multiple ids) or id+text tuples, if text input is allowed.",
      "properties": {
        "url": {
          "type": "string",
          "description": "URI to the JSON representation (SkoHub) of the vocabulary definition"
        },
        "allowMultipleValues": {
          "type": "boolean",
          "description": "If true, multiple values are allowed taken from the vocabulary",
          "default": false
        },
        "selectionMode": {
          "type": "string",
          "enum": ["in-form", "dialog"],
          "description": "UI variants: 'in-form' sets an radio or checkbox list in the form, 'dialog' challenges a modal dialog for selection (default).",
          "default": "dialog"
        },
        "maxLevel": {
          "type": "integer",
          "description": "Maximum level taken from the hierarchical vocabulary. This is to hide lower levels. Use '0' for all levels (default).",
          "default": 0
        },
        "hideNumbering": {
          "type": "boolean",
          "description": "If true, the numbering of vocabulary entries is not used/showed in components.",
          "default": false
        },
        "hideDescription": {
          "type": "boolean",
          "description": "If true, the description of vocabulary entries is not used/showed in components.",
          "default": false
        },
        "hideTitle": {
          "type": "boolean",
          "description": "If true, the title of vocabulary entries is not used/showed in components.",
          "default": false
        },
        "addTextLanguages": {
          "type": "array",
          "items": {
            "type": "string",
            "description": "ISO-language code",
            "pattern": "^[a-z]{2}$"
          },
          "description": "If not empty, text can be added to the selected vocabulary entry. The given entries specify the expected language(s).",
          "default": []
        }
      },
      "required": ["url"]
    },
    "text": {
      "type": "object",
      "description": "Creates values of type string (one possible language) or multi-language texts.",
      "properties": {
        "format": {
          "type": "string",
          "enum": ["single", "multiline", "html"],
          "description": "If true, more then one line of text is prepared for input. Text is wrapped and vertical scrolling is possible.",
          "default": "single"
        },
        "textLanguages": {
          "type": "array",
          "items": {
            "type": "string",
            "description": "ISO-language code",
            "pattern": "^[a-z]{2}$"
          },
          "description": "Use this property to add languages, so you provide more then one text input form field.",
          "default": [
            "de"
          ]
        },
        "pattern": {
          "type": "string",
          "description": "Use this regular expression to validate the input value."
        }
      }
    },
    "number": {
      "type": "object",
      "description": "Creates values of type string with number content. The decimal separator is always dot '.'.",
      "properties": {
        "digits": {
          "type": "integer",
          "description": "Number of digits. Negative values are not valid.",
          "minimum": 0,
          "default": 0
        },
        "minValue": {
          "type": "number",
          "description": "Minimal value valid for this entry."
        },
        "maxValue": {
          "type": "number",
          "description": "Maximal value valid for this entry."
        },
        "isPeriodSeconds": {
          "type": "boolean",
          "description": "If true, the (integer) value is interpreted as a number of seconds (duration, time period). This might adapt the form controls.",
          "default": false
        }
      }
    },
    "boolean": {
      "type": "object",
      "description": "Creates values of type string 'true' or 'false'.",
      "properties": {
        "trueLabel": {
          "$ref": "#/definitions/language_coded_texts"
        },
        "falseLabel": {
          "$ref": "#/definitions/language_coded_texts"
        }
      }
    },
    "entry": {
      "type": "object",
      "properties": {
        "id": {
          "type": "string",
          "pattern": "^[a-zA-Z][0-9a-zA-Z_]*$",
          "description": "Identifier for the property as part of the metadata profile"
        },
        "label": {
          "$ref": "#/definitions/language_coded_texts",
          "description": "Text presented in UI components as prompt"
        },
        "type": {
          "type": "string",
          "enum": ["text", "vocabulary", "boolean", "number"]
        },
        "parameters": {
          "anyOf": [
            {
              "$ref": "#/definitions/vocabulary"
            },
            {
              "$ref": "#/definitions/text"
            },
            {
              "$ref": "#/definitions/number"
            },
            {
              "$ref": "#/definitions/boolean"
            }
          ]
        }
      },
      "required": ["id", "type"]
    }
  }
}